<?xml version="1.0"?>
<xs:schema version="1.0"
           xmlns:xs="http://www.w3.org/2001/XMLSchema"
           elementFormDefault="qualified">
    <xs:element name="cv" type="cvType"/>
    <xs:complexType name="cvType">
        <xs:sequence>
            <xs:element name="surname" type="xs:string"/>
            <xs:element name="lastname" type="xs:string"/>
            <xs:element name="birthdate" type="xs:date"/>
            <xs:element name="address" type="xs:string"/>
            <xs:element name="city" type="xs:string"/>
            <xs:element name="country" type="xs:string"/>
            <xs:element name="phone" type="xs:string"/>
            <xs:element name="email">
                <xs:simpleType>
                    <xs:restriction base="xs:string">
                        <xs:pattern value=".*@{1}[a-z || 0-9]+\.[a-z]+"/>
                    </xs:restriction>
                </xs:simpleType>
            </xs:element>
            <xs:element name="about" type="xs:string"/>
            <xs:element name="references">
                <xs:complexType>
                    <xs:sequence>
                        <xs:element name="reference" minOccurs="2" maxOccurs="unbounded">
                            <xs:complexType>
                                <xs:sequence>
                                    <xs:element name="refName" type="xs:string" maxOccurs="1"/>
                                    <xs:element name="refAbout" type="xs:string" maxOccurs="1"/>
                                    <xs:element name="refContactInfo" type="xs:string" maxOccurs="1"/>
                                </xs:sequence>
                            </xs:complexType>
                        </xs:element>
                    </xs:sequence>
                </xs:complexType>
            </xs:element>
        </xs:sequence>
    </xs:complexType>
</xs:schema>
